{
  "schema_id": "EMBORA-PARAMS-2026-10-04-R1C6-v1.1",
  "specification_id": "EMBORA-MSJ1-2026-10-04-R1C6-v1.1",
  "condition_id": "AT-config",
  "pair_id": "AT-pair",
  "game": "UG",
  "focal_agent_id": 2,
  "selected_adapter_convention": "normative_resisted_inequity_v1",
  "run_purpose": "structural_fixture",
  "horizon": 2,
  "agents": [
    {
      "agent_id": 1,
      "seat": 1,
      "role": "proposer",
      "controller_type": "baseline",
      "baseline_id": "UG_Offer2"
    },
    {
      "agent_id": 2,
      "seat": 2,
      "role": "responder",
      "controller_type": "model",
      "variant": "full",
      "kind": "hybrid",
      "priority_profile": "fairness_high",
      "personality": "neutral",
      "intensity": "neutral",
      "initial_primary_state": {
        "v": {
          "material": 0.5,
          "fairness": 0.5,
          "relationship": 0.5,
          "safety": 0.5
        },
        "d": {
          "material": 1.0,
          "fairness": 1.0,
          "relationship": 1.0,
          "safety": 1.0
        },
        "p": {
          "material": 0.5,
          "fairness": 1.5,
          "relationship": 0.5,
          "safety": 0.5
        },
        "m": 0.0,
        "f": 0.0
      }
    }
  ],
  "model_mode": "journal_reference_v1",
  "stochastic_mode": "none",
  "rng_algorithm": null,
  "stream_id": null,
  "replicate_id": null,
  "training": false,
  "dqn_config": null,
  "refocus_config": null
}
